{
  "$schema": "../usecase.schema.json",
  "slug": "document-intelligence",
  "title": "Document Intelligence",
  "summary": "Retrieval over internal policy and contract libraries. Answers cite the source passages they were drawn from.",
  "status": "beta",
  "owner": "Knowledge Management",
  "tags": ["rag", "search", "documents"],
  "resources": ["nutanix-enterprise-ai"],
  "api": {
    "enabled": false
  },
  "links": []
}
