{
  "$schema": "../usecase.schema.json",
  "slug": "dynamic-offer-engine",
  "title": "Dynamic Offer Engine",
  "summary": "Propose an offer within two minutes of a trigger event, sized by player value and churn risk, for a human to approve. Suppressed players never reach the queue.",
  "status": "planned",
  "owner": "unassigned",
  "tags": ["Promotions", "Personalization", "Real-time"],
  "category": "Marketing",
  "icon": "tag",
  "accent": "navy",
  "resources": ["nkp", "casino-data-platform", "openrouter", "vector-db"],
  "api": {
    "enabled": false,
    "baseUrlEnv": "DYNAMIC_OFFER_ENGINE_API_URL"
  },
  "links": [
    { "label": "Design", "href": "/use-cases/dynamic-offer-engine/DESIGN.md" },
    { "label": "Portfolio design", "href": "/docs/casino-uc-design.md" },
    { "label": "Scope", "href": "/docs/casino-scope.md" }
  ]
}
