{
  "$schema": "../usecase.schema.json",
  "slug": "churn-risk-modeling",
  "title": "Churn-Risk Modeling",
  "summary": "Flag disengaging players before they stop visiting, using each player's own visit cadence rather than a fixed calendar window.",
  "status": "beta",
  "owner": "Player Development",
  "tags": ["Retention", "Scoring", "Early Warning"],
  "category": "Risk & Compliance",
  "icon": "shield",
  "accent": "teal",
  "resources": [],
  "api": {
    "enabled": false,
    "baseUrlEnv": "CHURN_RISK_MODELING_API_URL"
  },
  "links": [
    { "label": "Design", "href": "/use-cases/churn-risk-modeling/DESIGN.md" },
    { "label": "Portfolio design", "href": "/docs/casino-uc-design.md" },
    { "label": "Scope", "href": "/docs/casino-scope.md" }
  ]
}
